[
  {
    "work_order_id": "INT29-001",
    "source_task_ids": [
      "V2-GOV-01",
      "V3-INT-09"
    ],
    "title": "Bảo toàn nguồn và nối biên nhận nhập liệu",
    "status": "PROPOSED_NOT_DISPATCHED",
    "scope": {
      "capabilities": [
        "Đối chiếu 827 tệp ZIP, ba tệp V2 rời, 216 tệp kế hoạch hiện có; giữ provenance và SHA từng tệp."
      ],
      "cohort": "SYNTHETIC_PREPARATION_ONLY; actual product cohort pending acceptance",
      "environment": "DOCUMENTATION",
      "purpose": "Chuẩn bị đặc tả, tiêu chí và bằng chứng cho work order; chưa cấp quyền sửa ứng dụng hoặc tích hợp provider",
      "data_classes": [
        "public_planning_sources",
        "synthetic_fixture_design"
      ]
    },
    "exclusions": [
      "application/runtime edits until a scoped candidate work order is accepted",
      "production/provider/database writes",
      "real personal data",
      "implicit approval of methods/pricing/territory"
    ],
    "owner": {
      "role": "Governance + Documentation",
      "name": null,
      "accepted_at": null
    },
    "reviewer": {
      "role": "Independent QA + relevant Method/Security/Privacy/Legal authority",
      "name": null,
      "accepted_at": null
    },
    "authority": {
      "work_scope_authorized": true,
      "decision_receipts": [],
      "provider_access_authorized": false,
      "production_action_authorized": false
    },
    "baseline": {
      "repo_root": "/Users/tranhatam/Library/Mobile Documents/com~apple~CloudDocs/Documents/Devnewproject/Life-Code-OS",
      "remote": "git@github.com:tranhatam-collab/Life-Code-OS.git",
      "branch": "codex/complete-upgrade-plan-2026-10-20",
      "full_head_sha": "336ef35a8386a744c6de18a7f7c6e268e89e6dac",
      "worktree_status_receipt": "docs/upgrade/sources/2026-10-29/SOURCE_RECEIPT.json",
      "candidate_artifact_sha256": null,
      "source_bundle_receipt": "docs/upgrade/sources/2026-10-29/SOURCE_RECEIPT.json",
      "target_environment": "DOCUMENTATION_ONLY_UNTIL_SCOPED_DISPATCH"
    },
    "source_refs": [
      {
        "package_id": "LOCAL_2026_10_29",
        "path": "docs/upgrade/2026-10-29/execution/INTEGRATION_WORK_ORDERS.json",
        "sha256": "1d13c0ff0bc79aab1f06370ed124fd9a75125d281e5ec992106e559aa613e3c3",
        "source_record_id": "INT29-001"
      },
      {
        "package_id": "V3_INCOMING",
        "path": "docs/upgrade/sources/2026-10-29/v3/package/LIFE_CODE_OS_ALL_IN_ONE_V3_2026-10-29/09_EXECUTION/BACKLOG_UNIFIED.json",
        "sha256": "537762818003b07d58a1cb3ce0ac44f498cc011d79ffef402730af8f59d02ee1",
        "source_record_id": "V2-GOV-01"
      },
      {
        "package_id": "V3_INCOMING",
        "path": "docs/upgrade/sources/2026-10-29/v3/package/LIFE_CODE_OS_ALL_IN_ONE_V3_2026-10-29/09_EXECUTION/BACKLOG_UNIFIED.json",
        "sha256": "537762818003b07d58a1cb3ce0ac44f498cc011d79ffef402730af8f59d02ee1",
        "source_record_id": "V3-INT-09"
      }
    ],
    "dependencies": {
      "task_dependencies": [],
      "decision_dependencies": [
        "Q21",
        "Q31",
        "Q45"
      ],
      "gate_dependencies": [
        "G01"
      ],
      "parent_rollup_ids": [
        "V2-GOV-01",
        "V3-INT-09"
      ],
      "raw_source_dependencies": [
        "V2-GOV-01",
        "V3-INT-09"
      ],
      "scoped_completion_rule": "Mỗi dependency được đóng cho capability/cohort/candidate của work order; chưa phát hành phương pháp khác không ép hoàn tất toàn portfolio. Mọi non-applicable phải có người duyệt và lý do; không bỏ core auth/privacy/rights."
    },
    "version_bundle": {
      "profile_version": null,
      "hypothesis_version": null,
      "schema_version": null,
      "method_release": null,
      "source_edition_digest": null,
      "rights_receipt": null,
      "formula_config_digest": null,
      "consent_revision": null,
      "purpose": null,
      "locale_release": null,
      "claim_policy": null,
      "model_prompt_release": null
    },
    "deliverables": [
      {
        "path": "evidence/INT29-001/<candidate-digest>/",
        "artifact_kind": "scoped work-order receipt + spec/diff/tests",
        "review_method": "Compare acceptance with source, positive/negative cases, independent review and rollback evidence"
      }
    ],
    "acceptance": [
      {
        "criterion": "Số lượng, SHA và đường dẫn khớp nguồn; không đổi byte cũ; mọi đường dẫn đích ở đúng dự án.",
        "expected_result": "Số lượng, SHA và đường dẫn khớp nguồn; không đổi byte cũ; mọi đường dẫn đích ở đúng dự án.",
        "source_or_decision_ref": "execution/INTEGRATION_WORK_ORDERS.json#INT29-001"
      },
      {
        "criterion": "Mọi receipt ghi source/candidate/artifact digest, môi trường, lệnh, exit code, số pass/fail/skip và người review; dữ liệu thật không đưa vào fixture.",
        "expected_result": "Mọi receipt ghi source/candidate/artifact digest, môi trường, lệnh, exit code, số pass/fail/skip và người review; dữ liệu thật không đưa vào fixture.",
        "source_or_decision_ref": "execution/INTEGRATION_WORK_ORDERS.json#INT29-001"
      }
    ],
    "tests": {
      "positive": [
        "Số lượng, SHA và đường dẫn khớp nguồn; không đổi byte cũ; mọi đường dẫn đích ở đúng dự án."
      ],
      "negative": [
        "Thử tệp thiếu, tệp đích khác byte, traversal, symlink, ZIP lỗi; phải chặn và ghi receipt."
      ],
      "boundary": [
        "Check missing/ambiguous/stale input within this exact work-order scope; final fixture IDs selected at dispatch"
      ],
      "privacy_and_auth": [
        "Synthetic data only in preparation; permission-negative scenarios required before integration"
      ],
      "failure_and_recovery": [
        "Chỉ tạo vùng tài liệu mới, lưu manifest; phục hồi bằng danh sách tệp mới có hash và không xóa dữ liệu người dùng."
      ],
      "performance_class": null,
      "fixture_provenance": "Source corpus versions preserved; new fixtures must carry synthetic label, source/rule/config digest and expected result",
      "skips_with_reasons": []
    },
    "evidence": {
      "directory": "evidence/INT29-001/<candidate-digest>/",
      "receipt_fields": [
        "candidate SHA",
        "artifact/source/config digests",
        "commands/env/exit status",
        "pass/fail/skip and expected/actual",
        "independent reviewer",
        "decision/gate scope",
        "rollback proof"
      ],
      "independent_review_receipt": null,
      "status": "NOT_CHECKED"
    },
    "rollback": {
      "trigger": "Acceptance, authorization, source identity or reconciliation fails",
      "operator_role": "Governance + Documentation",
      "procedure": "Chỉ tạo vùng tài liệu mới, lưu manifest; phục hồi bằng danh sách tệp mới có hash và không xóa dữ liệu người dùng.",
      "data_reconciliation": "Record exact affected scope; quarantine unknown records; never merge only by name/DOB",
      "restore_deletion_barrier": "Apply deletion/revocation tombstones before restored private data can be accessed",
      "verification": "Independent reviewer checks rollback on the same scoped candidate or synthetic fixture"
    },
    "estimate": {
      "low_person_days": 1,
      "high_person_days": 2,
      "status": "PROPOSAL_NOT_APPROVED",
      "rollup_policy": "REFINEMENT_NOT_AUTOMATICALLY_ADDITIVE_TO_SOURCE_TASKS",
      "overlaps_source_task_ids": [
        "V2-GOV-01",
        "V3-INT-09"
      ],
      "currency": null,
      "monetary_value": null
    },
    "release": {
      "production_permission": false,
      "approver_names": null,
      "gate_receipts": [],
      "expires_or_revisit": "Before any change from documentation preparation to scoped DEV/staging"
    }
  },
  {
    "work_order_id": "INT29-002",
    "source_task_ids": [
      "P0-01",
      "P0-02",
      "P0-08",
      "V2-OPS-01",
      "V3-INT-10"
    ],
    "title": "Khóa đúng repository và phân biệt source/runtime",
    "status": "PROPOSED_NOT_DISPATCHED",
    "scope": {
      "capabilities": [
        "Lập receipt cwd/remote/branch/full HEAD/dirty paths, candidate riêng và deployment mapping nếu sau này có quyền."
      ],
      "cohort": "SYNTHETIC_PREPARATION_ONLY; actual product cohort pending acceptance",
      "environment": "DOCUMENTATION",
      "purpose": "Chuẩn bị đặc tả, tiêu chí và bằng chứng cho work order; chưa cấp quyền sửa ứng dụng hoặc tích hợp provider",
      "data_classes": [
        "public_planning_sources",
        "synthetic_fixture_design"
      ]
    },
    "exclusions": [
      "application/runtime edits until a scoped candidate work order is accepted",
      "production/provider/database writes",
      "real personal data",
      "implicit approval of methods/pricing/territory"
    ],
    "owner": {
      "role": "Tech Lead + Release Lead",
      "name": null,
      "accepted_at": null
    },
    "reviewer": {
      "role": "Independent QA + relevant Method/Security/Privacy/Legal authority",
      "name": null,
      "accepted_at": null
    },
    "authority": {
      "work_scope_authorized": true,
      "decision_receipts": [],
      "provider_access_authorized": false,
      "production_action_authorized": false
    },
    "baseline": {
      "repo_root": "/Users/tranhatam/Library/Mobile Documents/com~apple~CloudDocs/Documents/Devnewproject/Life-Code-OS",
      "remote": "git@github.com:tranhatam-collab/Life-Code-OS.git",
      "branch": "codex/complete-upgrade-plan-2026-10-20",
      "full_head_sha": "336ef35a8386a744c6de18a7f7c6e268e89e6dac",
      "worktree_status_receipt": "docs/upgrade/sources/2026-10-29/SOURCE_RECEIPT.json",
      "candidate_artifact_sha256": null,
      "source_bundle_receipt": "docs/upgrade/sources/2026-10-29/SOURCE_RECEIPT.json",
      "target_environment": "DOCUMENTATION_ONLY_UNTIL_SCOPED_DISPATCH"
    },
    "source_refs": [
      {
        "package_id": "LOCAL_2026_10_29",
        "path": "docs/upgrade/2026-10-29/execution/INTEGRATION_WORK_ORDERS.json",